[
  {
    "id": "EMP-SPLASH-001",
    "role": "shared",
    "module": "Splash",
    "screen": "Launch",
    "functionality": "2–4 sec logo",
    "online": true,
    "offline": true,
    "layer": "A",
    "tags": [
      "regression",
      "ui"
    ],
    "steps": [
      "Cold-start the release APK",
      "Observe splash branding and duration"
    ],
    "expected": "Logo/brand splash displays ~2–4s then navigates without crash"
  },
  {
    "id": "EMP-SPLASH-002",
    "role": "shared",
    "module": "Splash",
    "screen": "Launch",
    "functionality": "Deep-link / resume after kill",
    "online": true,
    "offline": false,
    "layer": "A",
    "tags": [
      "regression",
      "session"
    ],
    "steps": [
      "Force-stop app",
      "Relaunch",
      "Confirm splash then last-auth routing"
    ],
    "expected": "Splash appears once; authenticated users skip login, guests land on launch flow"
  },
  {
    "id": "EMP-SPLASH-003",
    "role": "shared",
    "module": "Splash",
    "screen": "Launch",
    "functionality": "Offline splash still branded",
    "online": false,
    "offline": true,
    "layer": "A",
    "tags": [
      "offline",
      "ui"
    ],
    "steps": [
      "Enable airplane mode",
      "Launch app"
    ],
    "expected": "Splash renders offline; no blank flash; proceeds to offline-capable next screen"
  },
  {
    "id": "EMP-ONB-001",
    "role": "shared",
    "module": "Onboarding",
    "screen": "Carousel",
    "functionality": "First-run slides",
    "online": true,
    "offline": true,
    "layer": "A",
    "tags": [
      "regression",
      "ui"
    ],
    "steps": [
      "Clear app data",
      "Launch",
      "Swipe through all onboarding slides"
    ],
    "expected": "All slides show copy/images; next/skip controls work"
  },
  {
    "id": "EMP-ONB-002",
    "role": "shared",
    "module": "Onboarding",
    "screen": "Carousel",
    "functionality": "Skip to login/launch",
    "online": true,
    "offline": false,
    "layer": "A",
    "tags": [
      "regression"
    ],
    "steps": [
      "On first slide tap Skip/Get Started"
    ],
    "expected": "User exits onboarding to Book Demo / Login entry without loop"
  },
  {
    "id": "EMP-ONB-003",
    "role": "shared",
    "module": "Onboarding",
    "screen": "Carousel",
    "functionality": "Do not re-show after complete",
    "online": true,
    "offline": false,
    "layer": "A",
    "tags": [
      "regression",
      "session"
    ],
    "steps": [
      "Complete onboarding",
      "Kill app",
      "Relaunch"
    ],
    "expected": "Onboarding does not reappear for same install"
  },
  {
    "id": "EMP-DEMO-001",
    "role": "shared",
    "module": "Book a Demo",
    "screen": "Form",
    "functionality": "Submit valid demo request",
    "online": true,
    "offline": false,
    "layer": "A",
    "tags": [
      "regression",
      "forms"
    ],
    "steps": [
      "Open Book a Demo",
      "Fill required fields with valid data",
      "Submit"
    ],
    "expected": "Success confirmation; no crash; fields validated"
  },
  {
    "id": "EMP-DEMO-002",
    "role": "shared",
    "module": "Book a Demo",
    "screen": "Form",
    "functionality": "Validation empty fields",
    "online": true,
    "offline": false,
    "layer": "A",
    "tags": [
      "regression",
      "forms",
      "ui"
    ],
    "steps": [
      "Open Book a Demo",
      "Submit with empty required fields"
    ],
    "expected": "Inline validation errors; submit blocked"
  },
  {
    "id": "EMP-DEMO-003",
    "role": "shared",
    "module": "Book a Demo",
    "screen": "Form",
    "functionality": "Offline submit blocked gracefully",
    "online": false,
    "offline": true,
    "layer": "A",
    "tags": [
      "offline",
      "forms"
    ],
    "steps": [
      "Airplane mode",
      "Open Book a Demo",
      "Attempt submit"
    ],
    "expected": "Clear offline/error message; no silent failure"
  },
  {
    "id": "EMP-DEMO-004",
    "role": "shared",
    "module": "Book a Demo",
    "screen": "Form",
    "functionality": "Back navigation draft behavior",
    "online": true,
    "offline": false,
    "layer": "A",
    "tags": [
      "forms",
      "ui"
    ],
    "steps": [
      "Partially fill form",
      "Navigate back",
      "Return"
    ],
    "expected": "Behavior matches design (preserve or clear) without crash"
  },
  {
    "id": "EMP-LEGAL-001",
    "role": "shared",
    "module": "Terms",
    "screen": "Legal",
    "functionality": "Open Terms of Service",
    "online": true,
    "offline": true,
    "layer": "A",
    "tags": [
      "regression",
      "legal",
      "ui"
    ],
    "steps": [
      "From launch/login/more open Terms"
    ],
    "expected": "Terms content loads (or cached offline); scrollable; back works"
  },
  {
    "id": "EMP-LEGAL-002",
    "role": "shared",
    "module": "Privacy",
    "screen": "Legal",
    "functionality": "Open Privacy Policy",
    "online": true,
    "offline": true,
    "layer": "A",
    "tags": [
      "regression",
      "legal",
      "ui"
    ],
    "steps": [
      "Open Privacy Policy from launch/login/more"
    ],
    "expected": "Privacy content loads; scrollable; back works"
  },
  {
    "id": "EMP-LEGAL-003",
    "role": "shared",
    "module": "Terms",
    "screen": "Legal",
    "functionality": "Accept terms gate if required",
    "online": true,
    "offline": false,
    "layer": "A",
    "tags": [
      "regression",
      "legal"
    ],
    "steps": [
      "Trigger any terms acceptance gate if present",
      "Accept"
    ],
    "expected": "Acceptance recorded; user can proceed"
  },
  {
    "id": "EMP-LOGIN-001",
    "role": "shared",
    "module": "Login",
    "screen": "Email",
    "functionality": "Valid email continues",
    "online": true,
    "offline": false,
    "layer": "A",
    "tags": [
      "regression",
      "auth"
    ],
    "steps": [
      "Open email login",
      "Enter known employee email",
      "Continue"
    ],
    "expected": "Proceeds to password step without error"
  },
  {
    "id": "EMP-LOGIN-002",
    "role": "shared",
    "module": "Login",
    "screen": "Email",
    "functionality": "Invalid email format",
    "online": true,
    "offline": false,
    "layer": "A",
    "tags": [
      "regression",
      "auth",
      "forms"
    ],
    "steps": [
      "Enter malformed email",
      "Continue"
    ],
    "expected": "Validation error; does not advance"
  },
  {
    "id": "EMP-LOGIN-003",
    "role": "shared",
    "module": "Login",
    "screen": "Email",
    "functionality": "Unknown email message",
    "online": true,
    "offline": false,
    "layer": "A",
    "tags": [
      "regression",
      "auth"
    ],
    "steps": [
      "Enter non-registered email",
      "Continue"
    ],
    "expected": "Clear user-not-found or equivalent message"
  },
  {
    "id": "EMP-LOGIN-004",
    "role": "shared",
    "module": "Login",
    "screen": "Password",
    "functionality": "Valid employee password",
    "online": true,
    "offline": false,
    "layer": "A",
    "tags": [
      "regression",
      "auth"
    ],
    "steps": [
      "Enter valid email",
      "Enter correct password",
      "Sign in"
    ],
    "expected": "Lands on employee home / permissions flow"
  },
  {
    "id": "EMP-LOGIN-005",
    "role": "shared",
    "module": "Login",
    "screen": "Password",
    "functionality": "Wrong password",
    "online": true,
    "offline": false,
    "layer": "A",
    "tags": [
      "regression",
      "auth",
      "security"
    ],
    "steps": [
      "Enter valid email",
      "Enter wrong password",
      "Sign in"
    ],
    "expected": "Error shown; no session created"
  },
  {
    "id": "EMP-LOGIN-006",
    "role": "shared",
    "module": "Login",
    "screen": "Password",
    "functionality": "Show/hide password toggle",
    "online": true,
    "offline": true,
    "layer": "A",
    "tags": [
      "ui",
      "auth"
    ],
    "steps": [
      "On password field toggle visibility"
    ],
    "expected": "Mask/unmask works; value preserved"
  },
  {
    "id": "EMP-LOGIN-007",
    "role": "shared",
    "module": "Login",
    "screen": "Forgot",
    "functionality": "Forgot password request",
    "online": true,
    "offline": false,
    "layer": "A",
    "tags": [
      "regression",
      "auth"
    ],
    "steps": [
      "Tap Forgot password",
      "Submit registered email"
    ],
    "expected": "Reset/instructions confirmation shown"
  },
  {
    "id": "EMP-LOGIN-008",
    "role": "shared",
    "module": "Login",
    "screen": "Forgot",
    "functionality": "Forgot with unknown email",
    "online": true,
    "offline": false,
    "layer": "A",
    "tags": [
      "auth",
      "security"
    ],
    "steps": [
      "Forgot flow with unknown email"
    ],
    "expected": "Safe message (no account enumeration if designed that way) or clear error"
  },
  {
    "id": "EMP-LOGIN-009",
    "role": "shared",
    "module": "Login",
    "screen": "Email",
    "functionality": "Offline login attempt",
    "online": false,
    "offline": true,
    "layer": "A",
    "tags": [
      "offline",
      "auth"
    ],
    "steps": [
      "Airplane mode",
      "Attempt sign-in"
    ],
    "expected": "Offline error; no hang"
  },
  {
    "id": "EMP-LOGIN-010",
    "role": "manager",
    "module": "Login",
    "screen": "Password",
    "functionality": "Valid manager password",
    "online": true,
    "offline": false,
    "layer": "A",
    "tags": [
      "regression",
      "auth"
    ],
    "steps": [
      "Sign in with manager credentials"
    ],
    "expected": "Lands on manager overview / manager nav"
  },
  {
    "id": "EMP-LOGIN-011",
    "role": "shared",
    "module": "Login",
    "screen": "Password",
    "functionality": "Enter key submits",
    "online": true,
    "offline": false,
    "layer": "A",
    "tags": [
      "auth",
      "ui"
    ],
    "steps": [
      "Fill password",